{
  "$schema": "https://architecture-kit.invalid/schemas/benchmark.schema.json",
  "kind": "synthetic-retrieval",
  "observed_on": "2026-09-13",
  "runner_sha256": "a86bed39aebf40d6d935bc891aab695d1d0a6afcb13bacab34ef6d326aed6a8c",
  "catalog_sha256": "506b7d89a5cb4daef54db58222b29f2fbbc1617234687942f560323775de55e5",
  "environment": {
    "system": "Linux",
    "architecture": "x86_64",
    "python": "3.14.7",
    "memory_limit_bytes": null
  },
  "corpus_sha256": "df842631943a3e7e5755aa2ac93328e4b667b9868439732cceeee6537c55fe13",
  "identities": {
    "rg": {
      "version": "ripgrep 15.2.0",
      "executable_sha256": "ec6b7f28ad296b05011f7d61a9b0c197dba8b80c27d949b9fa6ce5db2a495434"
    },
    "grep": {
      "version": "grep (GNU grep) 3.12",
      "executable_sha256": "50ad89244c68fd571037f2980c5c61a1514485a5ce7d5e5a12dda45aac9be733"
    }
  },
  "semantics": "fixed-string, explicit sorted UTF-8 files including hidden; C locale; no symlinks",
  "warmup_runs": 1,
  "samples_per_case": 20,
  "cache_state": "warm-uncontrolled",
  "estimator": "median of raw wall-clock milliseconds; no tail or confidence claim",
  "records": [
    {
      "candidate": "rg",
      "case": "positive",
      "argv": [
        "rg",
        "--no-config",
        "--sort",
        "path",
        "--color=never",
        "-F",
        "-n",
        "-H",
        "--",
        "needle",
        ".hidden.txt",
        "file-000.txt",
        "file-001.txt",
        "file-002.txt",
        "file-003.txt",
        "file-004.txt",
        "file-005.txt",
        "file-006.txt",
        "file-007.txt",
        "file-008.txt",
        "file-009.txt",
        "file-010.txt",
        "file-011.txt",
        "file-012.txt",
        "file-013.txt",
        "file-014.txt",
        "file-015.txt",
        "file-016.txt",
        "file-017.txt",
        "file-018.txt",
        "file-019.txt",
        "file-020.txt",
        "file-021.txt",
        "file-022.txt",
        "file-023.txt",
        "file-024.txt",
        "file-025.txt",
        "file-026.txt",
        "file-027.txt",
        "file-028.txt",
        "file-029.txt",
        "file-030.txt",
        "file-031.txt",
        "file-032.txt",
        "file-033.txt",
        "file-034.txt",
        "file-035.txt",
        "file-036.txt",
        "file-037.txt",
        "file-038.txt",
        "file-039.txt",
        "file-040.txt",
        "file-041.txt",
        "file-042.txt",
        "file-043.txt",
        "file-044.txt",
        "file-045.txt",
        "file-046.txt",
        "file-047.txt",
        "file-048.txt",
        "file-049.txt",
        "file-050.txt",
        "file-051.txt",
        "file-052.txt",
        "file-053.txt",
        "file-054.txt",
        "file-055.txt",
        "file-056.txt",
        "file-057.txt",
        "file-058.txt",
        "file-059.txt",
        "file-060.txt",
        "file-061.txt",
        "file-062.txt",
        "file-063.txt",
        "file-064.txt",
        "file-065.txt",
        "file-066.txt",
        "file-067.txt",
        "file-068.txt",
        "file-069.txt",
        "file-070.txt",
        "file-071.txt",
        "file-072.txt",
        "file-073.txt",
        "file-074.txt",
        "file-075.txt",
        "file-076.txt",
        "file-077.txt",
        "file-078.txt",
        "file-079.txt",
        "file-080.txt",
        "file-081.txt",
        "file-082.txt",
        "file-083.txt",
        "file-084.txt",
        "file-085.txt",
        "file-086.txt",
        "file-087.txt",
        "file-088.txt",
        "file-089.txt",
        "file-090.txt",
        "file-091.txt",
        "file-092.txt",
        "file-093.txt",
        "file-094.txt",
        "file-095.txt",
        "file-096.txt",
        "file-097.txt",
        "file-098.txt",
        "file-099.txt",
        "space name.txt"
      ],
      "samples_ms": [
        2.214854,
        2.481489,
        2.540851,
        2.209003,
        2.198112,
        2.342906,
        2.430111,
        2.269457,
        2.386038,
        2.44522,
        2.515904,
        2.858673,
        2.657291,
        2.431895,
        2.567091,
        2.638697,
        2.444008,
        2.312639,
        2.169979,
        2.760356
      ],
      "median_ms": 2.4379515,
      "exit_code": 0,
      "stdout_bytes": 352,
      "result_sha256": "b0156e32d668a95941e9b8d231ad5e6224e53e27461c17bb1cf53cea1946dfcb",
      "correct": true
    },
    {
      "candidate": "grep",
      "case": "positive",
      "argv": [
        "grep",
        "--color=never",
        "-F",
        "-n",
        "-H",
        "--",
        "needle",
        ".hidden.txt",
        "file-000.txt",
        "file-001.txt",
        "file-002.txt",
        "file-003.txt",
        "file-004.txt",
        "file-005.txt",
        "file-006.txt",
        "file-007.txt",
        "file-008.txt",
        "file-009.txt",
        "file-010.txt",
        "file-011.txt",
        "file-012.txt",
        "file-013.txt",
        "file-014.txt",
        "file-015.txt",
        "file-016.txt",
        "file-017.txt",
        "file-018.txt",
        "file-019.txt",
        "file-020.txt",
        "file-021.txt",
        "file-022.txt",
        "file-023.txt",
        "file-024.txt",
        "file-025.txt",
        "file-026.txt",
        "file-027.txt",
        "file-028.txt",
        "file-029.txt",
        "file-030.txt",
        "file-031.txt",
        "file-032.txt",
        "file-033.txt",
        "file-034.txt",
        "file-035.txt",
        "file-036.txt",
        "file-037.txt",
        "file-038.txt",
        "file-039.txt",
        "file-040.txt",
        "file-041.txt",
        "file-042.txt",
        "file-043.txt",
        "file-044.txt",
        "file-045.txt",
        "file-046.txt",
        "file-047.txt",
        "file-048.txt",
        "file-049.txt",
        "file-050.txt",
        "file-051.txt",
        "file-052.txt",
        "file-053.txt",
        "file-054.txt",
        "file-055.txt",
        "file-056.txt",
        "file-057.txt",
        "file-058.txt",
        "file-059.txt",
        "file-060.txt",
        "file-061.txt",
        "file-062.txt",
        "file-063.txt",
        "file-064.txt",
        "file-065.txt",
        "file-066.txt",
        "file-067.txt",
        "file-068.txt",
        "file-069.txt",
        "file-070.txt",
        "file-071.txt",
        "file-072.txt",
        "file-073.txt",
        "file-074.txt",
        "file-075.txt",
        "file-076.txt",
        "file-077.txt",
        "file-078.txt",
        "file-079.txt",
        "file-080.txt",
        "file-081.txt",
        "file-082.txt",
        "file-083.txt",
        "file-084.txt",
        "file-085.txt",
        "file-086.txt",
        "file-087.txt",
        "file-088.txt",
        "file-089.txt",
        "file-090.txt",
        "file-091.txt",
        "file-092.txt",
        "file-093.txt",
        "file-094.txt",
        "file-095.txt",
        "file-096.txt",
        "file-097.txt",
        "file-098.txt",
        "file-099.txt",
        "space name.txt"
      ],
      "samples_ms": [
        2.0118,
        2.409602,
        2.411596,
        2.211899,
        2.402249,
        2.009745,
        2.421044,
        2.298002,
        2.024514,
        2.045464,
        2.1762,
        2.157205,
        2.006199,
        2.264086,
        2.391439,
        2.17606,
        2.382391,
        2.129001,
        2.102341,
        2.303743
      ],
      "median_ms": 2.1940495,
      "exit_code": 0,
      "stdout_bytes": 352,
      "result_sha256": "b0156e32d668a95941e9b8d231ad5e6224e53e27461c17bb1cf53cea1946dfcb",
      "correct": true
    },
    {
      "candidate": "rg",
      "case": "negative",
      "argv": [
        "rg",
        "--no-config",
        "--sort",
        "path",
        "--color=never",
        "-F",
        "-n",
        "-H",
        "--",
        "missing-marker",
        ".hidden.txt",
        "file-000.txt",
        "file-001.txt",
        "file-002.txt",
        "file-003.txt",
        "file-004.txt",
        "file-005.txt",
        "file-006.txt",
        "file-007.txt",
        "file-008.txt",
        "file-009.txt",
        "file-010.txt",
        "file-011.txt",
        "file-012.txt",
        "file-013.txt",
        "file-014.txt",
        "file-015.txt",
        "file-016.txt",
        "file-017.txt",
        "file-018.txt",
        "file-019.txt",
        "file-020.txt",
        "file-021.txt",
        "file-022.txt",
        "file-023.txt",
        "file-024.txt",
        "file-025.txt",
        "file-026.txt",
        "file-027.txt",
        "file-028.txt",
        "file-029.txt",
        "file-030.txt",
        "file-031.txt",
        "file-032.txt",
        "file-033.txt",
        "file-034.txt",
        "file-035.txt",
        "file-036.txt",
        "file-037.txt",
        "file-038.txt",
        "file-039.txt",
        "file-040.txt",
        "file-041.txt",
        "file-042.txt",
        "file-043.txt",
        "file-044.txt",
        "file-045.txt",
        "file-046.txt",
        "file-047.txt",
        "file-048.txt",
        "file-049.txt",
        "file-050.txt",
        "file-051.txt",
        "file-052.txt",
        "file-053.txt",
        "file-054.txt",
        "file-055.txt",
        "file-056.txt",
        "file-057.txt",
        "file-058.txt",
        "file-059.txt",
        "file-060.txt",
        "file-061.txt",
        "file-062.txt",
        "file-063.txt",
        "file-064.txt",
        "file-065.txt",
        "file-066.txt",
        "file-067.txt",
        "file-068.txt",
        "file-069.txt",
        "file-070.txt",
        "file-071.txt",
        "file-072.txt",
        "file-073.txt",
        "file-074.txt",
        "file-075.txt",
        "file-076.txt",
        "file-077.txt",
        "file-078.txt",
        "file-079.txt",
        "file-080.txt",
        "file-081.txt",
        "file-082.txt",
        "file-083.txt",
        "file-084.txt",